2026-02-11,Who was the first democratically elected black president of South Africa?,Jacob Zuma,Thabo Mbeki,Kgalema Motlanthe,::Nelson Rolihlahla Mandela
2026-02-12,"Born as Mool Shankar Tiwari, Swami Dayanand Saraswati was the founder of which society?",Brahmo Samaj,::Arya Samaj,Prarthana Samaj,Satyashodhak Samaj
2026-02-13,Which organisation governs and regulates the Indian Super League (ISL)?,FIFO,FIFA,IIFA,::AIFF
2026-02-14,St. Valentine belonged to which empire?,Ottoman Empire,::Roman Empire,Persian Empire,Akkadian Empire
2026-02-15,"Which mountain is considered the divine, heavenly abode of Lord Shiva, where he lives an ascetic life?",Adi Kailash,Kinnaur Kailash,::Mount Kailash,Manimahesh Kailash
2026-02-16,Which metal was used to make King Tutankhuamun's innermost coffin which was sealed inside the burial chamber?,::Gold,Copper,Silver,Bronze